{
  "version": 1,
  "agent": "claude-code",
  "session": "rate-limit-realistic",
  "transcript": "present",
  "adapter": {
    "name": "claude-code",
    "version": "2.1.289",
    "level": "full",
    "degraded_reason": ""
  },
  "range": {
    "base": "f596631028f948ff24775c314f83300856038b6d",
    "head": "b1d234e4bcfcf124ea1f1e7bdc6cba38677b7cbb",
    "base_source": "captured"
  },
  "thresholds": {
    "invite": 0.2,
    "low": 0.15
  },
  "prompts": [
    {
      "turn": 1,
      "text": "Add rate limiting to the public API: 60 requests per minute per client, answer 429 with a Retry-After header"
    }
  ],
  "result": "unasked",
  "hunks": [
    {
      "id": "h01",
      "file": ".env.example",
      "lines": "3-5",
      "verdict": "invited",
      "label": "unknown",
      "asked": 0.30346101907514883,
      "said": 0,
      "tell": null,
      "statement": "Documenting the new settings in .env.example.",
      "turn": 1,
      "references_elsewhere": 0,
      "summary": "changed .env.example:3-5",
      "reason": "asked: turn 1",
      "hash": "b75ca9fa3196",
      "high_risk": false
    },
    {
      "id": "h02",
      "file": "internal/api/handlers.go",
      "lines": "8-8",
      "verdict": "unasked",
      "label": "unknown",
      "severity": "warning",
      "asked": 0.03900621522824356,
      "said": 0,
      "tell": "noticed",
      "statement": "I also noticed a typo in the listProducts doc comment and fixed it.",
      "turn": 1,
      "references_elsewhere": 0,
      "summary": "changed internal/api/handlers.go:8-8",
      "reason": "no match",
      "hash": "928d4f3cea3d",
      "high_risk": false
    },
    {
      "id": "h03",
      "file": "internal/api/headers.go",
      "lines": "15-15",
      "verdict": "unasked",
      "label": "deletion",
      "severity": "error",
      "asked": 0.4465691064183444,
      "said": 0.15222391705518,
      "tell": null,
      "statement": "I'm removing the deprecated X-Request-Id header from responses; it is not needed anymore.",
      "turn": 1,
      "removed_symbols": [
        "X-Request-Id"
      ],
      "references_elsewhere": 3,
      "summary": "deleted header X-Request-Id still referenced in 3 files",
      "reason": "asked: generic overlap only",
      "hash": "631802b7c197",
      "high_risk": true
    },
    {
      "id": "h04",
      "file": "internal/api/middleware/logging.go",
      "lines": "12-12",
      "verdict": "unasked",
      "label": "refactor",
      "severity": "warning",
      "asked": 0.07508897627951217,
      "said": 0.05638243636424681,
      "tell": null,
      "statement": "I'll also switch the request log to UTC timestamps with nanosecond precision.",
      "turn": 1,
      "references_elsewhere": 0,
      "summary": "changed body of Logging",
      "reason": "no match",
      "hash": "b5a9f04eefa1",
      "high_risk": false
    },
    {
      "id": "h05",
      "file": "internal/api/middleware/logging.go",
      "lines": "14-14",
      "verdict": "unclear",
      "label": "refactor",
      "severity": "warning",
      "asked": 0.15079210045820404,
      "said": 0.05638243636424681,
      "tell": null,
      "statement": "I'll also switch the request log to UTC timestamps with nanosecond precision.",
      "turn": 1,
      "references_elsewhere": 0,
      "summary": "changed body of Logging",
      "reason": "weak match",
      "hash": "07d810e2ec1e",
      "high_risk": false
    },
    {
      "id": "h06",
      "file": "internal/api/router.go",
      "lines": "8-8",
      "verdict": "unasked",
      "label": "collateral",
      "severity": "warning",
      "asked": 0.07338705404812496,
      "said": 0,
      "tell": null,
      "statement": "Wiring the limiter into the router.",
      "turn": 1,
      "references_elsewhere": 0,
      "summary": "formatting/import changes in internal/api/router.go",
      "reason": "no match",
      "hash": "2eb20e0d9cf3",
      "high_risk": false
    },
    {
      "id": "h07",
      "file": "internal/api/router.go",
      "lines": "16-17",
      "verdict": "unclear",
      "label": "refactor",
      "severity": "warning",
      "asked": 0.19815036955877643,
      "said": 0,
      "tell": null,
      "turn": 1,
      "references_elsewhere": 0,
      "summary": "changed body of NewRouter",
      "reason": "weak match",
      "hash": "94415d8d12ce",
      "high_risk": false
    },
    {
      "id": "h08",
      "file": "internal/config/config.go",
      "lines": "6-6",
      "verdict": "invited",
      "label": "collateral",
      "severity": "info",
      "asked": 0,
      "said": 0.19734307070525706,
      "tell": null,
      "statement": "Now the config: the limits come from RATE_LIMIT_ANON, RATE_LIMIT_KEYED and RATE_LIMIT_WINDOW.",
      "turn": 1,
      "references_elsewhere": 0,
      "summary": "formatting/import changes in internal/config/config.go",
      "reason": "collateral",
      "hash": "878a2d653d9e",
      "high_risk": false
    },
    {
      "id": "h09",
      "file": "internal/config/config.go",
      "lines": "14-17",
      "verdict": "invited",
      "label": "refactor",
      "asked": 0.33097970199556065,
      "said": 0,
      "tell": null,
      "turn": 1,
      "references_elsewhere": 0,
      "summary": "changed body of Config",
      "reason": "asked: turn 1",
      "hash": "1d4bff5ec5b3",
      "high_risk": false
    },
    {
      "id": "h10",
      "file": "internal/config/config.go",
      "lines": "22-22",
      "verdict": "invited",
      "label": "collateral",
      "severity": "info",
      "asked": 0,
      "said": 0,
      "tell": null,
      "turn": 0,
      "references_elsewhere": 0,
      "summary": "formatting/import changes in internal/config/config.go",
      "reason": "collateral",
      "hash": "9b5870bc0ffe",
      "high_risk": false
    },
    {
      "id": "h11",
      "file": "internal/config/config.go",
      "lines": "26-28",
      "verdict": "invited",
      "label": "feature",
      "asked": 0.24215284588710523,
      "said": 0,
      "tell": null,
      "turn": 1,
      "references_elsewhere": 0,
      "summary": "added RATE_LIMIT_ANON",
      "reason": "asked: turn 1",
      "hash": "12984d86a2d0",
      "high_risk": false
    },
    {
      "id": "h12",
      "file": "internal/config/config.go",
      "lines": "32-39",
      "verdict": "invited",
      "label": "unknown",
      "asked": 0,
      "said": 0,
      "tell": null,
      "turn": 1,
      "references_elsewhere": 0,
      "summary": "changed internal/config/config.go:32-39",
      "reason": "required by h11",
      "hash": "3fe12ebf6c64",
      "high_risk": false
    },
    {
      "id": "h13",
      "file": "internal/config/config.go",
      "lines": "46-55",
      "verdict": "invited",
      "label": "unknown",
      "asked": 0,
      "said": 0,
      "tell": null,
      "statement": "Adding a parseDuration helper so a malformed window falls back to the default instead of failing startup.",
      "turn": 1,
      "references_elsewhere": 0,
      "summary": "changed internal/config/config.go:46-55",
      "reason": "required by h11",
      "hash": "c687ac886e77",
      "high_risk": false
    },
    {
      "id": "h14",
      "file": "internal/ratelimit/limiter.go",
      "lines": "1-66",
      "verdict": "invited",
      "label": "feature",
      "asked": 0.747226438581734,
      "said": 0.5271908879816158,
      "tell": null,
      "statement": "I'll look at how the router and config are set up first. I'll add a fixed-window rate limiter package with separate anonymous and keyed limits that answers 429 with a Retry-After header.",
      "turn": 1,
      "references_elsewhere": 0,
      "summary": "added Limiter",
      "reason": "asked: turn 1",
      "hash": "5a991d490458",
      "high_risk": false
    }
  ],
  "kept": [],
  "stats": {
    "hunks": 12,
    "invited": 6,
    "unasked": 4,
    "unclear": 2,
    "collateral": 2,
    "binary": 0
  },
  "warnings": [],
  "turns": 1,
  "duration": "3 min"
}
